{
  "$schema": "https://schemas.alos.dev/v1/context/context-bundle.schema.json",
  "context_id": "context_mvp1_research_001",
  "tenant_id": "tenant_mvp1_001",
  "organization_id": "org_mvp1_001",
  "workspace_id": "workspace_mvp1_001",
  "actor_id": "actor_mvp1_researcher_001",
  "correlation_id": "corr_mvp1_context_001",
  "scope_refs": ["scope.sources.read"],
  "created_at": "2026-09-16T02:00:00Z",
  "items": [
    {
      "key": "source_mvp1_policy_001@1.0.0#L1-L1",
      "value": "Legacy policy context enriched by the Backend boundary.",
      "source_id": "source_mvp1_policy_001",
      "evidence_id": "evidence_mvp1_policy_001",
      "source_version": "1.0.0",
      "content_hash": "sha256:aaaaaaaaaaaaaaaaaaaaaaaaaaaaaaaaaaaaaaaaaaaaaaaaaaaaaaaaaaaaaaaa",
      "anchor": "lines 1-1",
      "data_classification": "INTERNAL"
    }
  ]
}
